Lanzada por el usuario [8mha:////4ASAjq7C/sSB4sIzq+4BVAAZsrwMTV3jKz30sL1zmxUIAAAAlx+LCAAAAAAAAP9b85aBtbiIQTGjNKU4P08vOT+vOD8nVc83PyU1x6OyILUoJzMv2y+/JJUBAhiZGBgqihhk0NSjKDWzXb3RdlLBUSYGJk8GtpzUvPSSDB8G5tKinBIGIZ+sxLJE/ZzEvHT94JKizLx0a6BxUmjGOUNodHsLgAzWEgZu/dLi1CL9xJTczDwAj6GcLcAAAAA=[0madmin
Ejecutando.en el espacio de trabajo C:\Users\sergiog\.jenkins\workspace\Run_Tests_Local_Secuencial
 > git.exe rev-parse --is-inside-work-tree # timeout=10
Fetching changes from the remote Git repository
 > git.exe config remote.origin.url https://github.com/sglezcasco/sgc-tfgii.git # timeout=10
Fetching upstream changes from https://github.com/sglezcasco/sgc-tfgii.git
 > git.exe --version # timeout=10
 > git.exe fetch --tags --progress https://github.com/sglezcasco/sgc-tfgii.git +refs/heads/*:refs/remotes/origin/*
 > git.exe rev-parse "refs/remotes/origin/master^{commit}" # timeout=10
 > git.exe rev-parse "refs/remotes/origin/origin/master^{commit}" # timeout=10
Checking out Revision 82875a017b1715bca35760eec2c87a27d23ba747 (refs/remotes/origin/master)
 > git.exe config core.sparsecheckout # timeout=10
 > git.exe checkout -f 82875a017b1715bca35760eec2c87a27d23ba747
Commit message: "changes to include new attribute test"
 > git.exe rev-list --no-walk 82875a017b1715bca35760eec2c87a27d23ba747 # timeout=10
Run condition [Boolean condition] enabling prebuild for step [Ejecutar un comando de Windows]
Run condition [Boolean condition] enabling prebuild for step [Ejecutar un comando de Windows]
Run condition [Boolean condition] enabling prebuild for step [Ejecutar un comando de Windows]
Run condition [Boolean condition] enabling prebuild for step [Ejecutar un comando de Windows]
[Run_Tests_Local_Secuencial] $ cmd /c call C:\Users\sergiog\AppData\Local\Temp\jenkins7188975386732171911.bat

C:\Users\sergiog\.jenkins\workspace\Run_Tests_Local_Secuencial>mvn eclipse:eclipse 
[INFO] Scanning for projects...
[INFO]                                                                         
[INFO] ------------------------------------------------------------------------
[INFO] Building Selenium Tests 1.0.0
[INFO] ------------------------------------------------------------------------
[INFO] 
[INFO] >>> maven-eclipse-plugin:2.10:eclipse (default-cli) > generate-resources @ pruebas-selenium >>>
[INFO] 
[INFO] <<< maven-eclipse-plugin:2.10:eclipse (default-cli) < generate-resources @ pruebas-selenium <<<
[INFO] 
[INFO] --- maven-eclipse-plugin:2.10:eclipse (default-cli) @ pruebas-selenium ---
[INFO] Using Eclipse Workspace: null
[INFO] Adding default classpath container: org.eclipse.jdt.launching.JRE_CONTAINER/org.eclipse.jdt.internal.debug.ui.launcher.StandardVMType/JavaSE-1.8
[INFO] File C:\Users\sergiog\.jenkins\workspace\Run_Tests_Local_Secuencial\.project already exists.
       Additional settings will be preserved, run mvn eclipse:clean if you want old settings to be removed.
[INFO] Wrote Eclipse project for "pruebas-selenium" to C:\Users\sergiog\.jenkins\workspace\Run_Tests_Local_Secuencial.
[INFO] 
[INFO] ------------------------------------------------------------------------
[INFO] BUILD SUCCESS
[INFO] ------------------------------------------------------------------------
[INFO] Total time: 3.078 s
[INFO] Finished at: 2018-03-22T20:02:10+01:00
[INFO] Final Memory: 15M/222M
[INFO] ------------------------------------------------------------------------
[Boolean condition] checking [true] against [^(1|y|yes|t|true|on|run)$] (origin token: ${Firefox})
Run condition [Boolean condition] enabling perform for step [Ejecutar un comando de Windows]
[Run_Tests_Local_Secuencial] $ cmd /c call C:\Users\sergiog\AppData\Local\Temp\jenkins1094831176710677363.bat

C:\Users\sergiog\.jenkins\workspace\Run_Tests_Local_Secuencial>mvn -Dtest=unir.net.tfgii.selenium.tests.Login,unir.net.tfgii.selenium.tests.Registro -DdriverProvider=MozillaFirefoxDriver -Dexecution=local -Dhost=localhost test 
[INFO] Scanning for projects...
[INFO]                                                                         
[INFO] ------------------------------------------------------------------------
[INFO] Building Selenium Tests 1.0.0
[INFO] ------------------------------------------------------------------------
[INFO] 
[INFO] --- maven-resources-plugin:2.6:resources (default-resources) @ pruebas-selenium ---
[INFO] Using 'UTF-8' encoding to copy filtered resources.
[INFO] skip non existing resourceDirectory C:\Users\sergiog\.jenkins\workspace\Run_Tests_Local_Secuencial\src\main\resources
[INFO] 
[INFO] --- maven-compiler-plugin:3.3:compile (default-compile) @ pruebas-selenium ---
[INFO] No sources to compile
[INFO] 
[INFO] --- maven-resources-plugin:2.6:testResources (default-testResources) @ pruebas-selenium ---
[INFO] Using 'UTF-8' encoding to copy filtered resources.
[INFO] Copying 4 resources
[INFO] 
[INFO] --- maven-compiler-plugin:3.3:testCompile (default-testCompile) @ pruebas-selenium ---
[INFO] Nothing to compile - all classes are up to date
[INFO] 
[INFO] --- maven-surefire-plugin:2.14.1:test (default-test) @ pruebas-selenium ---
[INFO] Surefire report directory: C:\Users\sergiog\.jenkins\workspace\Run_Tests_Local_Secuencial\target\surefire-reports

-------------------------------------------------------
 T E S T S
-------------------------------------------------------
Running TestSuite
Configuring TestNG with: TestNG652Configurator
2018-03-22 20:02:15.357 unir.net.tfgii.selenium.drivers.MozillaFirefoxDriver DEBUG - Inicializando driver Firefox:C:\SoftDesarrollo\SeleniumWebdriver\geckodriver.exe
1521745336222	geckodriver	INFO	geckodriver 0.19.0
1521745336230	geckodriver	INFO	Listening on 127.0.0.1:18859
1521745336873	mozrunner::runner	INFO	Running command: "C:\\Program Files\\Mozilla Firefox\\firefox.exe" "-marionette" "-profile" "C:\\Users\\sergiog\\AppData\\Local\\Temp\\rust_mozprofile.kHUMWex2UeIb"
Unable to read VR Path Registry from C:\Users\sergiog\AppData\Local\openvr\openvrpaths.vrpath
1521745337902	Marionette	INFO	Enabled via --marionette
Unable to read VR Path Registry from C:\Users\sergiog\AppData\Local\openvr\openvrpaths.vrpath
Unable to read VR Path Registry from C:\Users\sergiog\AppData\Local\openvr\openvrpaths.vrpath
Unable to read VR Path Registry from C:\Users\sergiog\AppData\Local\openvr\openvrpaths.vrpath
[Child 892, Chrome_ChildThread] WARNING: pipe error: 109: file z:/build/build/src/ipc/chromium/src/chrome/common/ipc_channel_win.cc, line 346
[Child 892, Chrome_ChildThread] WARNING: pipe error: 10Unable to read VR Path Registry from C:\Users\sergiog\AppData\Local\openvr\openvrpaths.vrpath
1521745340473	addons.xpi	WARN	Exception running bootstrap method shutdown on activity-stream@mozilla.org: [Exception... "Component returned failure code: 0x80004005 (NS_ERROR_FAILURE) [nsIObserverService.removeObserver]"  nsresult: "0x80004005 (NS_ERROR_FAILURE)"  location: "JS frame :: resource://activity-stream/lib/SnippetsFeed.jsm :: uninit :: line 123"  data: no] Stack trace: uninit()@resource://activity-stream/lib/SnippetsFeed.jsm:123 < onAction()@resource://activity-stream/lib/SnippetsFeed.jsm:138 < _middleware/</<()@resource://activity-stream/lib/Store.jsm:52 < Store/this[method]()@resource://activity-stream/lib/Store.jsm:31 < uninit()@resource://activity-stream/lib/Store.jsm:151 < uninit()@resource://activity-stream/lib/ActivityStream.jsm:266 < uninit()@resource://gre/modules/addons/XPIProvider.jsm -> jar:file:///C:/Program%20Files/Mozilla%20Firefox/browser/features/activity-stream@mozilla.org.xpi!/bootstrap.js:80 < shutdown()@resource://gre/modules/addons/XPIProvider.jsm -> jar:file:///C:/Program%20Files/Mozilla%20Firefox/browser/features/activity-stream@mozilla.org.xpi!/bootstrap.js:196 < callBootstrapMethod()@resource://gre/modules/addons/XPIProvider.jsm:4509 < observe()@resource://gre/modules/addons/XPIProvider.jsm:2281
[Child 3868, Chrome_ChildThread] WARNING: pipe error: 109: file z:/build/build/src/ipc/chromium/src/chrome/common/ipc_channel_win.cc, line 346
Promise rejected while context is inactive: Message manager disconnected
1521745341850	Marionette	INFO	Listening on port 55791
*** UTM:SVC TimerManager:registerTimer called after profile-before-change notification. Ignoring timer registration for id: telemetry_modules_ping

###!!! [Child][MessageChannel::SendAndWait] Error: Channel error: cannot send/recv

2018-03-22 20:02:25.396 unir.net.tfgii.selenium.init.SeleniumDriverOperations ERROR - Process unexpectedly closed with status: 0
Build info: version: '3.9.1', revision: '63f7b50', time: '2018-02-07T22:25:02.294Z'
System info: host: 'DESKTOP-BB2IEAS', ip: '169.254.116.234', os.name: 'Windows 10', os.arch: 'amd64', os.version: '10.0', java.version: '1.8.0_112'
Driver info: driver.version: MozillaFirefoxDriver
remote stacktrace: stack backtrace:
   0:           0x4821c4 - <no info>
   1:           0x482933 - <no info>
   2:           0x445159 - <no info>
   3:           0x44c838 - <no info>
   4:           0x43026a - <no info>
   5:           0x40ba4e - <no info>
   6:           0x4119b9 - <no info>
   7:           0x6d2c89 - <no info>
   8:           0x426006 - <no info>
   9:           0x6cd490 - <no info>
  10:     0x7ffa602d1fe4 - BaseThreadInitThunk
org.openqa.selenium.WebDriverException: Process unexpectedly closed with status: 0
Build info: version: '3.9.1', revision: '63f7b50', time: '2018-02-07T22:25:02.294Z'
System info: host: 'DESKTOP-BB2IEAS', ip: '169.254.116.234', os.name: 'Windows 10', os.arch: 'amd64', os.version: '10.0', java.version: '1.8.0_112'
Driver info: driver.version: MozillaFirefoxDriver
remote stacktrace: stack backtrace:
   0:           0x4821c4 - <no info>
   1:           0x482933 - <no info>
   2:           0x445159 - <no info>
   3:           0x44c838 - <no info>
   4:           0x43026a - <no info>
   5:           0x40ba4e - <no info>
   6:           0x4119b9 - <no info>
   7:           0x6d2c89 - <no info>
   8:           0x426006 - <no info>
   9:           0x6cd490 - <no info>
  10:     0x7ffa602d1fe4 - BaseThreadInitThunk
	at sun.reflect.NativeConstructorAccessorImpl.newInstance0(Native Method)
	at sun.reflect.NativeConstructorAccessorImpl.newInstance(NativeConstructorAccessorImpl.java:62)
	at sun.reflect.DelegatingConstructorAccessorImpl.newInstance(DelegatingConstructorAccessorImpl.java:45)
	at java.lang.reflect.Constructor.newInstance(Constructor.java:423)
	at org.openqa.selenium.remote.W3CHandshakeResponse.lambda$new$0(W3CHandshakeResponse.java:57)
	at org.openqa.selenium.remote.W3CHandshakeResponse.lambda$getResponseFunction$2(W3CHandshakeResponse.java:104)
	at org.openqa.selenium.remote.ProtocolHandshake.lambda$createSession$0(ProtocolHandshake.java:123)
	at java.util.stream.ReferencePipeline$3$1.accept(ReferencePipeline.java:193)
	at java.util.Spliterators$ArraySpliterator.tryAdvance(Spliterators.java:958)
	at java.util.stream.ReferencePipeline.forEachWithCancel(ReferencePipeline.java:126)
	at java.util.stream.AbstractPipeline.copyIntoWithCancel(AbstractPipeline.java:498)
	at java.util.stream.AbstractPipeline.copyInto(AbstractPipeline.java:485)
	at java.util.stream.AbstractPipeline.wrapAndCopyInto(AbstractPipeline.java:471)
	at java.util.stream.FindOps$FindOp.evaluateSequential(FindOps.java:152)
	at java.util.stream.AbstractPipeline.evaluate(AbstractPipeline.java:234)
	at java.util.stream.ReferencePipeline.findFirst(ReferencePipeline.java:464)
	at org.openqa.selenium.remote.ProtocolHandshake.createSession(ProtocolHandshake.java:126)
	at org.openqa.selenium.remote.ProtocolHandshake.createSession(ProtocolHandshake.java:73)
	at org.openqa.selenium.remote.HttpCommandExecutor.execute(HttpCommandExecutor.java:138)
	at org.openqa.selenium.remote.service.DriverCommandExecutor.execute(DriverCommandExecutor.java:83)
	at org.openqa.selenium.remote.RemoteWebDriver.execute(RemoteWebDriver.java:601)
	at org.openqa.selenium.remote.RemoteWebDriver.startSession(RemoteWebDriver.java:219)
	at org.openqa.selenium.remote.RemoteWebDriver.<init>(RemoteWebDriver.java:142)
	at org.openqa.selenium.firefox.FirefoxDriver.<init>(FirefoxDriver.java:120)
	at unir.net.tfgii.selenium.drivers.MozillaFirefoxDriver.initDriver(MozillaFirefoxDriver.java:42)
	at unir.net.tfgii.selenium.init.SeleniumDriverOperations.testBeforeClass(SeleniumDriverOperations.java:54)
	at sun.reflect.NativeMethodAccessorImpl.invoke0(Native Method)
	at sun.reflect.NativeMethodAccessorImpl.invoke(NativeMethodAccessorImpl.java:62)
	at sun.reflect.DelegatingMethodAccessorImpl.invoke(DelegatingMethodAccessorImpl.java:43)
	at java.lang.reflect.Method.invoke(Method.java:498)
	at org.testng.internal.MethodInvocationHelper.invokeMethod(MethodInvocationHelper.java:80)
	at org.testng.internal.Invoker.invokeConfigurationMethod(Invoker.java:564)
	at org.testng.internal.Invoker.invokeConfigurations(Invoker.java:213)
	at org.testng.internal.Invoker.invokeConfigurations(Invoker.java:138)
	at org.testng.internal.TestMethodWorker.invokeBeforeClassMethods(TestMethodWorker.java:175)
	at org.testng.internal.TestMethodWorker.run(TestMethodWorker.java:107)
	at org.testng.TestRunner.privateRun(TestRunner.java:767)
	at org.testng.TestRunner.run(TestRunner.java:617)
	at org.testng.SuiteRunner.runTest(SuiteRunner.java:334)
	at org.testng.SuiteRunner.runSequentially(SuiteRunner.java:329)
	at org.testng.SuiteRunner.privateRun(SuiteRunner.java:291)
	at org.testng.SuiteRunner.run(SuiteRunner.java:240)
	at org.testng.SuiteRunnerWorker.runSuite(SuiteRunnerWorker.java:52)
	at org.testng.SuiteRunnerWorker.run(SuiteRunnerWorker.java:86)
	at org.testng.TestNG.runSuitesSequentially(TestNG.java:1198)
	at org.testng.TestNG.runSuitesLocally(TestNG.java:1123)
	at org.testng.TestNG.run(TestNG.java:1031)
	at org.apache.maven.surefire.testng.TestNGExecutor.run(TestNGExecutor.java:77)
	at org.apache.maven.surefire.testng.TestNGDirectoryTestSuite.executeMulti(TestNGDirectoryTestSuite.java:189)
	at org.apache.maven.surefire.testng.TestNGDirectoryTestSuite.execute(TestNGDirectoryTestSuite.java:105)
	at org.apache.maven.surefire.testng.TestNGProvider.invoke(TestNGProvider.java:117)
	at sun.reflect.NativeMethodAccessorImpl.invoke0(Native Method)
	at sun.reflect.NativeMethodAccessorImpl.invoke(NativeMethodAccessorImpl.java:62)
	at sun.reflect.DelegatingMethodAccessorImpl.invoke(DelegatingMethodAccessorImpl.java:43)
	at java.lang.reflect.Method.invoke(Method.java:498)
	at org.apache.maven.surefire.util.ReflectionUtils.invokeMethodWithArray2(ReflectionUtils.java:208)
	at org.apache.maven.surefire.booter.ProviderFactory$ProviderProxy.invoke(ProviderFactory.java:159)
	at org.apache.maven.surefire.booter.ProviderFactory.invokeProvider(ProviderFactory.java:87)
	at org.apache.maven.surefire.booter.ForkedBooter.runSuitesInProcess(ForkedBooter.java:153)
	at org.apache.maven.surefire.booter.ForkedBooter.main(ForkedBooter.java:95)
2018-03-22 20:02:25.412 unir.net.tfgii.selenium.tests.Login DEBUG - INICIO- Caso de Prueba de Login
La url de inicio es: http://www.sgc-tfgii.es/index.html
2018-03-22 20:02:25.418 unir.net.tfgii.selenium.tests.base.BaseTestCase DEBUG - Cerrando el driver
2018-03-22 20:02:25.419 unir.net.tfgii.selenium.drivers.MozillaFirefoxDriver DEBUG - Inicializando driver Firefox:C:\SoftDesarrollo\SeleniumWebdriver\geckodriver.exe
1521745345512	geckodriver	INFO	geckodriver 0.19.0
1521745345520	geckodriver	INFO	Listening on 127.0.0.1:10891
1521745346019	mozrunner::runner	INFO	Running command: "C:\\Program Files\\Mozilla Firefox\\firefox.exe" "-marionette" "-profile" "C:\\Users\\sergiog\\AppData\\Local\\Temp\\rust_mozprofile.LTa8FBGVZZSi"
Unable to read VR Path Registry from C:\Users\sergiog\AppData\Local\openvr\openvrpaths.vrpath
1521745346870	Marionette	INFO	Enabled via --marionette
Unable to read VR Path Registry from C:\Users\sergiog\AppData\Local\openvr\openvrpaths.vrpath
Unable to read VR Path Registry from C:\Users\sergiog\AppData\Local\openvr\openvrpaths.vrpath
Unable to read VR Path Registry from C:\Users\sergiog\AppData\Local\openvr\openvrpaths.vrpath
[Parent 11584, Gecko_IOThread] WARNING: pipe error: 109: file z:/build/build/src/ipc/chromium/src/chrome/common/ipc_channel_win.cc, line 346
[Child 7896, Chrome_ChildThread] WARNING: pipe error: 109: file z:/build/build/src/ipc/chromium/src/chrome/common/ipc_channel_win.cc, line 346
[Child 7896, Chrome_ChildThread] WARNING: pipe error: 109: file z:/build/build/src/ipc/chromium/src/chrome/common/ipc_channel_win.cc, line 346
Unable to read VR Path Registry from C:\Users\sergiog\AppData\Local\openvr\openvrpaths.vrpath
1521745350343	Marionette	INFO	Listening on port 55815
1521745351286	Marionette	WARN	TLS certificate errors will be ignored for this session
1521745351361	Marionette	DEBUG	Register listener.js for window 4294967297
mar 22, 2018 8:02:31 PM org.openqa.selenium.remote.ProtocolHandshake createSession
INFORMACIÓN: Detected dialect: W3C
2018-03-22 20:02:35.213 unir.net.tfgii.selenium.init.SeleniumDriverOperations DEBUG - Driver inicializado correctamente
2018-03-22 20:02:35.214 unir.net.tfgii.selenium.tests.Registro DEBUG - INICIO- Caso de Prueba de Registro
La url de inicio es: http://www.sgc-tfgii.es/index.html
1521745355220	Marionette	DEBUG	Received DOM event "beforeunload" for "about:blank"
1521745355423	Marionette	DEBUG	Received DOM event "pagehide" for "about:blank"
1521745355423	Marionette	DEBUG	Received DOM event "unload" for "about:blank"
1521745356251	Marionette	DEBUG	Received DOM event "DOMContentLoaded" for "http://www.sgc-tfgii.es/index.html"
1521745356626	Marionette	DEBUG	Received DOM event "pageshow" for "http://www.sgc-tfgii.es/index.html"
2018-03-22 20:02:36.664 unir.net.tfgii.selenium.tests.Registro DEBUG - 01 -Cargamos la página de login
2018-03-22 20:02:36.717 unir.net.tfgii.selenium.tests.Registro DEBUG - 02 -Esperamos que cargue la página de login
2018-03-22 20:02:36.726 unir.net.tfgii.selenium.tests.Registro DEBUG - 03 -Comprobamos que es la pagina de login
1521745356763	Marionette	DEBUG	Received DOM event "beforeunload" for "http://www.sgc-tfgii.es/index.html"
1521745356847	Marionette	DEBUG	Received DOM event "pagehide" for "http://www.sgc-tfgii.es/index.html"
1521745356854	Marionette	DEBUG	Received DOM event "unload" for "http://www.sgc-tfgii.es/index.html"
1521745356957	Marionette	DEBUG	Received DOM event "DOMContentLoaded" for "http://www.sgc-tfgii.es/register.html"
1521745356963	Marionette	DEBUG	Received DOM event "pageshow" for "http://www.sgc-tfgii.es/register.html"
2018-03-22 20:02:36.966 unir.net.tfgii.selenium.pageobjects.PageObjectLoginPage DEBUG - Vamos al registro de usuarios
2018-03-22 20:02:36.972 unir.net.tfgii.selenium.tests.Registro DEBUG - 04 -Vamos al registro de usuarios
2018-03-22 20:02:37.017 unir.net.tfgii.selenium.tests.Registro DEBUG - 05 -Esperamos que cargue la página de registro
2018-03-22 20:02:37.026 unir.net.tfgii.selenium.tests.Registro DEBUG - 06 -Comprobamos que es la pagina de registro 
1521745362274	Marionette	DEBUG	Canceled page load listener because no navigation has been detected
1521745362690	Marionette	DEBUG	Canceled page load listener because no navigation has been detected
1521745363056	Marionette	DEBUG	Canceled page load listener because no navigation has been detected
2018-03-22 20:02:48.754 unir.net.tfgii.selenium.pageobjects.PageObjectRegisterPage DEBUG - Registro rellenado con usuario: sergiogc
2018-03-22 20:02:48.755 unir.net.tfgii.selenium.tests.Registro DEBUG - 07 -Datos formulario registro rellenados
JavaScript error: http://www.sgc-tfgii.es/register.html, line 1: SyntaxError: expected expression, got '.'
1521745368792	Marionette	DEBUG	Received DOM event "beforeunload" for "http://www.sgc-tfgii.es/register.html"
1521745368873	Marionette	DEBUG	Received DOM event "pagehide" for "http://www.sgc-tfgii.es/register.html"
1521745368874	Marionette	DEBUG	Received DOM event "unload" for "http://www.sgc-tfgii.es/register.html"
1521745368958	Marionette	DEBUG	Received DOM event "DOMContentLoaded" for "http://www.sgc-tfgii.es/listado.html?email=sgc%40gmail.com&sexo=male"
1521745369019	Marionette	DEBUG	Received DOM event "pageshow" for "http://www.sgc-tfgii.es/listado.html?email=sgc%40gmail.com&sexo=male"
2018-03-22 20:02:54.026 unir.net.tfgii.selenium.pageobjects.PageObjectRegisterPage DEBUG - Realizamos el registro. 
2018-03-22 20:02:54.032 unir.net.tfgii.selenium.tests.Registro DEBUG - 08 -Enviar Registrado
1521745374046	Marionette	DEBUG	Received DOM event "beforeunload" for "http://www.sgc-tfgii.es/listado.html?email=sgc%40gmail.com&sexo=male"
1521745374061	Marionette	DEBUG	Received DOM event "pagehide" for "http://www.sgc-tfgii.es/listado.html?email=sgc%40gmail.com&sexo=male"
1521745374061	Marionette	DEBUG	Received DOM event "unload" for "http://www.sgc-tfgii.es/listado.html?email=sgc%40gmail.com&sexo=male"
1521745374146	Marionette	DEBUG	Received DOM event "DOMContentLoaded" for "http://www.sgc-tfgii.es/index.html"
1521745374151	Marionette	DEBUG	Received DOM event "pageshow" for "http://www.sgc-tfgii.es/index.html"
2018-03-22 20:02:59.153 unir.net.tfgii.selenium.tests.Registro DEBUG - 09 -Salir
2018-03-22 20:02:59.153 unir.net.tfgii.selenium.tests.Registro DEBUG - FIN- TEST OK
2018-03-22 20:02:59.154 unir.net.tfgii.selenium.tests.base.BaseTestCase DEBUG - Cerrando el driver
Tests run: 2, Failures: 1, Errors: 0, Skipped: 0, Time elapsed: 45.232 sec <<< FAILURE!
login(unir.net.tfgii.selenium.tests.Login)  Time elapsed: 0.015 sec  <<< FAILURE!
java.lang.NullPointerException: null
	at unir.net.tfgii.selenium.tests.base.BaseTestCase.irUrlOrigen(BaseTestCase.java:32)
	at unir.net.tfgii.selenium.tests.Login.login(Login.java:35)


Results :

Failed tests: 
  Login.login:35->BaseTestCase.irUrlOrigen:32 » NullPointer

Tests run: 2, Failures: 1, Errors: 0, Skipped: 0

[INFO] ------------------------------------------------------------------------
[INFO] BUILD FAILURE
[INFO] ------------------------------------------------------------------------
[INFO] Total time: 48.195 s
[INFO] Finished at: 2018-03-22T20:03:00+01:00
[INFO] Final Memory: 14M/222M
[INFO] ------------------------------------------------------------------------
[ERROR] Failed to execute goal org.apache.maven.plugins:maven-surefire-plugin:2.14.1:test (default-test) on project pruebas-selenium: There are test failures.
[ERROR] 
[ERROR] Please refer to C:\Users\sergiog\.jenkins\workspace\Run_Tests_Local_Secuencial\target\surefire-reports for the individual test results.
[ERROR] -> [Help 1]
[ERROR] 
[ERROR] To see the full stack trace of the errors, re-run Maven with the -e switch.
[ERROR] Re-run Maven using the -X switch to enable full debug logging.
[ERROR] 
[ERROR] For more information about the errors and possible solutions, please read the following articles:
[ERROR] [Help 1] http://cwiki.apache.org/confluence/display/MAVEN/MojoFailureException
Build step 'Conditional step (single)' marked build as failure
Finished: FAILURE
