Lanzada por el usuario [8mha:////4ASAjq7C/sSB4sIzq+4BVAAZsrwMTV3jKz30sL1zmxUIAAAAlx+LCAAAAAAAAP9b85aBtbiIQTGjNKU4P08vOT+vOD8nVc83PyU1x6OyILUoJzMv2y+/JJUBAhiZGBgqihhk0NSjKDWzXb3RdlLBUSYGJk8GtpzUvPSSDB8G5tKinBIGIZ+sxLJE/ZzEvHT94JKizLx0a6BxUmjGOUNodHsLgAzWEgZu/dLi1CL9xJTczDwAj6GcLcAAAAA=[0madmin
Ejecutando.en el espacio de trabajo C:\Users\sergiog\.jenkins\workspace\Run_Tests_Remote_Secuencial
 > git.exe rev-parse --is-inside-work-tree # timeout=10
Fetching changes from the remote Git repository
 > git.exe config remote.origin.url https://github.com/sglezcasco/sgc-tfgii.git # timeout=10
Fetching upstream changes from https://github.com/sglezcasco/sgc-tfgii.git
 > git.exe --version # timeout=10
 > git.exe fetch --tags --progress https://github.com/sglezcasco/sgc-tfgii.git +refs/heads/*:refs/remotes/origin/*
 > git.exe rev-parse "refs/remotes/origin/master^{commit}" # timeout=10
 > git.exe rev-parse "refs/remotes/origin/origin/master^{commit}" # timeout=10
Checking out Revision 82875a017b1715bca35760eec2c87a27d23ba747 (refs/remotes/origin/master)
 > git.exe config core.sparsecheckout # timeout=10
 > git.exe checkout -f 82875a017b1715bca35760eec2c87a27d23ba747
Commit message: "changes to include new attribute test"
 > git.exe rev-list --no-walk 82875a017b1715bca35760eec2c87a27d23ba747 # timeout=10
Run condition [Boolean condition] enabling prebuild for step [Ejecutar un comando de Windows]
Run condition [Boolean condition] enabling prebuild for step [Ejecutar un comando de Windows]
Run condition [Boolean condition] enabling prebuild for step [Ejecutar un comando de Windows]
Run condition [Boolean condition] enabling prebuild for step [Ejecutar un comando de Windows]
[Run_Tests_Remote_Secuencial] $ cmd /c call C:\Users\sergiog\AppData\Local\Temp\jenkins5346696675816917691.bat

C:\Users\sergiog\.jenkins\workspace\Run_Tests_Remote_Secuencial>mvn eclipse:eclipse 
[INFO] Scanning for projects...
[INFO]                                                                         
[INFO] ------------------------------------------------------------------------
[INFO] Building Selenium Tests 1.0.0
[INFO] ------------------------------------------------------------------------
[INFO] 
[INFO] >>> maven-eclipse-plugin:2.10:eclipse (default-cli) > generate-resources @ pruebas-selenium >>>
[INFO] 
[INFO] <<< maven-eclipse-plugin:2.10:eclipse (default-cli) < generate-resources @ pruebas-selenium <<<
[INFO] 
[INFO] --- maven-eclipse-plugin:2.10:eclipse (default-cli) @ pruebas-selenium ---
[INFO] Using Eclipse Workspace: null
[INFO] Adding default classpath container: org.eclipse.jdt.launching.JRE_CONTAINER/org.eclipse.jdt.internal.debug.ui.launcher.StandardVMType/JavaSE-1.8
[INFO] File C:\Users\sergiog\.jenkins\workspace\Run_Tests_Remote_Secuencial\.project already exists.
       Additional settings will be preserved, run mvn eclipse:clean if you want old settings to be removed.
[INFO] Wrote Eclipse project for "pruebas-selenium" to C:\Users\sergiog\.jenkins\workspace\Run_Tests_Remote_Secuencial.
[INFO] 
[INFO] ------------------------------------------------------------------------
[INFO] BUILD SUCCESS
[INFO] ------------------------------------------------------------------------
[INFO] Total time: 2.599 s
[INFO] Finished at: 2018-03-22T21:13:23+01:00
[INFO] Final Memory: 15M/221M
[INFO] ------------------------------------------------------------------------
[Boolean condition] checking [true] against [^(1|y|yes|t|true|on|run)$] (origin token: ${Firefox})
Run condition [Boolean condition] enabling perform for step [Ejecutar un comando de Windows]
[Run_Tests_Remote_Secuencial] $ cmd /c call C:\Users\sergiog\AppData\Local\Temp\jenkins5860029583596474926.bat

C:\Users\sergiog\.jenkins\workspace\Run_Tests_Remote_Secuencial>mvn -Dtest=unir.net.tfgii.selenium.tests.Login,unir.net.tfgii.selenium.tests.Registro -DdriverProvider=MozillaFirefoxDriver -Dexecution=remote -Dhost=192.168.43.247 test 
[INFO] Scanning for projects...
[INFO]                                                                         
[INFO] ------------------------------------------------------------------------
[INFO] Building Selenium Tests 1.0.0
[INFO] ------------------------------------------------------------------------
[INFO] 
[INFO] --- maven-resources-plugin:2.6:resources (default-resources) @ pruebas-selenium ---
[INFO] Using 'UTF-8' encoding to copy filtered resources.
[INFO] skip non existing resourceDirectory C:\Users\sergiog\.jenkins\workspace\Run_Tests_Remote_Secuencial\src\main\resources
[INFO] 
[INFO] --- maven-compiler-plugin:3.3:compile (default-compile) @ pruebas-selenium ---
[INFO] No sources to compile
[INFO] 
[INFO] --- maven-resources-plugin:2.6:testResources (default-testResources) @ pruebas-selenium ---
[INFO] Using 'UTF-8' encoding to copy filtered resources.
[INFO] Copying 4 resources
[INFO] 
[INFO] --- maven-compiler-plugin:3.3:testCompile (default-testCompile) @ pruebas-selenium ---
[INFO] Nothing to compile - all classes are up to date
[INFO] 
[INFO] --- maven-surefire-plugin:2.14.1:test (default-test) @ pruebas-selenium ---
[INFO] Surefire report directory: C:\Users\sergiog\.jenkins\workspace\Run_Tests_Remote_Secuencial\target\surefire-reports

-------------------------------------------------------
 T E S T S
-------------------------------------------------------
Running TestSuite
Configuring TestNG with: TestNG652Configurator
2018-03-22 21:13:29.191 unir.net.tfgii.selenium.drivers.MozillaFirefoxDriver DEBUG - Inicializando driver Firefox Remoto
2018-03-22 21:14:02.199 unir.net.tfgii.selenium.init.SeleniumDriverOperations ERROR - Error forwarding the new session Error forwarding the request Connect to 169.254.3.218:5555 [/169.254.3.218] failed: Connection timed out: connect
Command duration or timeout: 32.49 seconds
Build info: version: '3.9.1', revision: '63f7b50', time: '2018-02-07T22:25:02.294Z'
System info: host: 'DESKTOP-BB2IEAS', ip: '169.254.116.234', os.name: 'Windows 10', os.arch: 'amd64', os.version: '10.0', java.version: '1.8.0_112'
Driver info: driver.version: MozillaFirefoxDriver
org.openqa.selenium.WebDriverException: Error forwarding the new session Error forwarding the request Connect to 169.254.3.218:5555 [/169.254.3.218] failed: Connection timed out: connect
Command duration or timeout: 32.49 seconds
Build info: version: '3.9.1', revision: '63f7b50', time: '2018-02-07T22:25:02.294Z'
System info: host: 'DESKTOP-BB2IEAS', ip: '169.254.116.234', os.name: 'Windows 10', os.arch: 'amd64', os.version: '10.0', java.version: '1.8.0_112'
Driver info: driver.version: MozillaFirefoxDriver
	at sun.reflect.NativeConstructorAccessorImpl.newInstance0(Native Method)
	at sun.reflect.NativeConstructorAccessorImpl.newInstance(NativeConstructorAccessorImpl.java:62)
	at sun.reflect.DelegatingConstructorAccessorImpl.newInstance(DelegatingConstructorAccessorImpl.java:45)
	at java.lang.reflect.Constructor.newInstance(Constructor.java:423)
	at org.openqa.selenium.remote.ErrorHandler.createThrowable(ErrorHandler.java:214)
	at org.openqa.selenium.remote.ErrorHandler.throwIfResponseFailed(ErrorHandler.java:166)
	at org.openqa.selenium.remote.JsonWireProtocolResponse.lambda$new$0(JsonWireProtocolResponse.java:53)
	at org.openqa.selenium.remote.JsonWireProtocolResponse.lambda$getResponseFunction$2(JsonWireProtocolResponse.java:91)
	at org.openqa.selenium.remote.ProtocolHandshake.lambda$createSession$0(ProtocolHandshake.java:123)
	at java.util.stream.ReferencePipeline$3$1.accept(ReferencePipeline.java:193)
	at java.util.Spliterators$ArraySpliterator.tryAdvance(Spliterators.java:958)
	at java.util.stream.ReferencePipeline.forEachWithCancel(ReferencePipeline.java:126)
	at java.util.stream.AbstractPipeline.copyIntoWithCancel(AbstractPipeline.java:498)
	at java.util.stream.AbstractPipeline.copyInto(AbstractPipeline.java:485)
	at java.util.stream.AbstractPipeline.wrapAndCopyInto(AbstractPipeline.java:471)
	at java.util.stream.FindOps$FindOp.evaluateSequential(FindOps.java:152)
	at java.util.stream.AbstractPipeline.evaluate(AbstractPipeline.java:234)
	at java.util.stream.ReferencePipeline.findFirst(ReferencePipeline.java:464)
	at org.openqa.selenium.remote.ProtocolHandshake.createSession(ProtocolHandshake.java:126)
	at org.openqa.selenium.remote.ProtocolHandshake.createSession(ProtocolHandshake.java:73)
	at org.openqa.selenium.remote.HttpCommandExecutor.execute(HttpCommandExecutor.java:138)
	at org.openqa.selenium.remote.RemoteWebDriver.execute(RemoteWebDriver.java:601)
	at org.openqa.selenium.remote.RemoteWebDriver.startSession(RemoteWebDriver.java:219)
	at org.openqa.selenium.remote.RemoteWebDriver.<init>(RemoteWebDriver.java:142)
	at org.openqa.selenium.remote.RemoteWebDriver.<init>(RemoteWebDriver.java:155)
	at unir.net.tfgii.selenium.drivers.MozillaFirefoxDriver.initDriver(MozillaFirefoxDriver.java:49)
	at unir.net.tfgii.selenium.init.SeleniumDriverOperations.testBeforeClass(SeleniumDriverOperations.java:54)
	at sun.reflect.NativeMethodAccessorImpl.invoke0(Native Method)
	at sun.reflect.NativeMethodAccessorImpl.invoke(NativeMethodAccessorImpl.java:62)
	at sun.reflect.DelegatingMethodAccessorImpl.invoke(DelegatingMethodAccessorImpl.java:43)
	at java.lang.reflect.Method.invoke(Method.java:498)
	at org.testng.internal.MethodInvocationHelper.invokeMethod(MethodInvocationHelper.java:80)
	at org.testng.internal.Invoker.invokeConfigurationMethod(Invoker.java:564)
	at org.testng.internal.Invoker.invokeConfigurations(Invoker.java:213)
	at org.testng.internal.Invoker.invokeConfigurations(Invoker.java:138)
	at org.testng.internal.TestMethodWorker.invokeBeforeClassMethods(TestMethodWorker.java:175)
	at org.testng.internal.TestMethodWorker.run(TestMethodWorker.java:107)
	at org.testng.TestRunner.privateRun(TestRunner.java:767)
	at org.testng.TestRunner.run(TestRunner.java:617)
	at org.testng.SuiteRunner.runTest(SuiteRunner.java:334)
	at org.testng.SuiteRunner.runSequentially(SuiteRunner.java:329)
	at org.testng.SuiteRunner.privateRun(SuiteRunner.java:291)
	at org.testng.SuiteRunner.run(SuiteRunner.java:240)
	at org.testng.SuiteRunnerWorker.runSuite(SuiteRunnerWorker.java:52)
	at org.testng.SuiteRunnerWorker.run(SuiteRunnerWorker.java:86)
	at org.testng.TestNG.runSuitesSequentially(TestNG.java:1198)
	at org.testng.TestNG.runSuitesLocally(TestNG.java:1123)
	at org.testng.TestNG.run(TestNG.java:1031)
	at org.apache.maven.surefire.testng.TestNGExecutor.run(TestNGExecutor.java:77)
	at org.apache.maven.surefire.testng.TestNGDirectoryTestSuite.executeMulti(TestNGDirectoryTestSuite.java:189)
	at org.apache.maven.surefire.testng.TestNGDirectoryTestSuite.execute(TestNGDirectoryTestSuite.java:105)
	at org.apache.maven.surefire.testng.TestNGProvider.invoke(TestNGProvider.java:117)
	at sun.reflect.NativeMethodAccessorImpl.invoke0(Native Method)
	at sun.reflect.NativeMethodAccessorImpl.invoke(NativeMethodAccessorImpl.java:62)
	at sun.reflect.DelegatingMethodAccessorImpl.invoke(DelegatingMethodAccessorImpl.java:43)
	at java.lang.reflect.Method.invoke(Method.java:498)
	at org.apache.maven.surefire.util.ReflectionUtils.invokeMethodWithArray2(ReflectionUtils.java:208)
	at org.apache.maven.surefire.booter.ProviderFactory$ProviderProxy.invoke(ProviderFactory.java:159)
	at org.apache.maven.surefire.booter.ProviderFactory.invokeProvider(ProviderFactory.java:87)
	at org.apache.maven.surefire.booter.ForkedBooter.runSuitesInProcess(ForkedBooter.java:153)
	at org.apache.maven.surefire.booter.ForkedBooter.main(ForkedBooter.java:95)
Caused by: org.openqa.grid.common.exception.GridException: Error forwarding the new session Error forwarding the request Connect to 169.254.3.218:5555 [/169.254.3.218] failed: Connection timed out: connect
	at org.openqa.grid.web.servlet.handler.RequestHandler.process(RequestHandler.java:117)
	at org.openqa.grid.web.servlet.DriverServlet.process(DriverServlet.java:84)
	at org.openqa.grid.web.servlet.DriverServlet.doPost(DriverServlet.java:68)
	at javax.servlet.http.HttpServlet.service(HttpServlet.java:707)
	at javax.servlet.http.HttpServlet.service(HttpServlet.java:790)
	at org.seleniumhq.jetty9.servlet.ServletHolder.handle(ServletHolder.java:841)
	at org.seleniumhq.jetty9.servlet.ServletHandler.doHandle(ServletHandler.java:535)
	at org.seleniumhq.jetty9.server.handler.ScopedHandler.nextHandle(ScopedHandler.java:188)
	at org.seleniumhq.jetty9.server.session.SessionHandler.doHandle(SessionHandler.java:1595)
	at org.seleniumhq.jetty9.server.handler.ScopedHandler.nextHandle(ScopedHandler.java:188)
	at org.seleniumhq.jetty9.server.handler.ContextHandler.doHandle(ContextHandler.java:1253)
	at org.seleniumhq.jetty9.server.handler.ScopedHandler.nextScope(ScopedHandler.java:168)
	at org.seleniumhq.jetty9.servlet.ServletHandler.doScope(ServletHandler.java:473)
	at org.seleniumhq.jetty9.server.session.SessionHandler.doScope(SessionHandler.java:1564)
	at org.seleniumhq.jetty9.server.handler.ScopedHandler.nextScope(ScopedHandler.java:166)
	at org.seleniumhq.jetty9.server.handler.ContextHandler.doScope(ContextHandler.java:1155)
	at org.seleniumhq.jetty9.server.handler.ScopedHandler.handle(ScopedHandler.java:141)
	at org.seleniumhq.jetty9.server.handler.HandlerWrapper.handle(HandlerWrapper.java:132)
	at org.seleniumhq.jetty9.server.Server.handle(Server.java:564)
	at org.seleniumhq.jetty9.server.HttpChannel.handle(HttpChannel.java:317)
	at org.seleniumhq.jetty9.server.HttpConnection.onFillable(HttpConnection.java:251)
	at org.seleniumhq.jetty9.io.AbstractConnection$ReadCallback.succeeded(AbstractConnection.java:279)
	at org.seleniumhq.jetty9.io.FillInterest.fillable(FillInterest.java:110)
	at org.seleniumhq.jetty9.io.ChannelEndPoint$2.run(ChannelEndPoint.java:124)
	at org.seleniumhq.jetty9.util.thread.Invocable.invokePreferred(Invocable.java:128)
	at org.seleniumhq.jetty9.util.thread.Invocable$InvocableExecutor.invoke(Invocable.java:222)
	at org.seleniumhq.jetty9.util.thread.strategy.EatWhatYouKill.doProduce(EatWhatYouKill.java:294)
	at org.seleniumhq.jetty9.util.thread.strategy.EatWhatYouKill.run(EatWhatYouKill.java:199)
	at org.seleniumhq.jetty9.util.thread.QueuedThreadPool.runJob(QueuedThreadPool.java:672)
	at org.seleniumhq.jetty9.util.thread.QueuedThreadPool$2.run(QueuedThreadPool.java:590)
	at java.lang.Thread.run(Thread.java:748)
2018-03-22 21:14:02.214 unir.net.tfgii.selenium.tests.Login DEBUG - INICIO- Caso de Prueba de Login
La url de inicio es: http://www.sgc-tfgii.es/index.html
2018-03-22 21:14:02.223 unir.net.tfgii.selenium.tests.base.BaseTestCase DEBUG - Cerrando el driver
2018-03-22 21:14:02.224 unir.net.tfgii.selenium.drivers.MozillaFirefoxDriver DEBUG - Inicializando driver Firefox Remoto
2018-03-22 21:15:22.744 unir.net.tfgii.selenium.init.SeleniumDriverOperations ERROR - Error forwarding the new session Error forwarding the request Connect to 169.254.3.218:5555 [/169.254.3.218] failed: Connection timed out: connect
Command duration or timeout: 80.49 seconds
Build info: version: '3.9.1', revision: '63f7b50', time: '2018-02-07T22:25:02.294Z'
System info: host: 'DESKTOP-BB2IEAS', ip: '169.254.116.234', os.name: 'Windows 10', os.arch: 'amd64', os.version: '10.0', java.version: '1.8.0_112'
Driver info: driver.version: MozillaFirefoxDriver
org.openqa.selenium.WebDriverException: Error forwarding the new session Error forwarding the request Connect to 169.254.3.218:5555 [/169.254.3.218] failed: Connection timed out: connect
Command duration or timeout: 80.49 seconds
Build info: version: '3.9.1', revision: '63f7b50', time: '2018-02-07T22:25:02.294Z'
System info: host: 'DESKTOP-BB2IEAS', ip: '169.254.116.234', os.name: 'Windows 10', os.arch: 'amd64', os.version: '10.0', java.version: '1.8.0_112'
Driver info: driver.version: MozillaFirefoxDriver
	at sun.reflect.NativeConstructorAccessorImpl.newInstance0(Native Method)
	at sun.reflect.NativeConstructorAccessorImpl.newInstance(NativeConstructorAccessorImpl.java:62)
	at sun.reflect.DelegatingConstructorAccessorImpl.newInstance(DelegatingConstructorAccessorImpl.java:45)
	at java.lang.reflect.Constructor.newInstance(Constructor.java:423)
	at org.openqa.selenium.remote.ErrorHandler.createThrowable(ErrorHandler.java:214)
	at org.openqa.selenium.remote.ErrorHandler.throwIfResponseFailed(ErrorHandler.java:166)
	at org.openqa.selenium.remote.JsonWireProtocolResponse.lambda$new$0(JsonWireProtocolResponse.java:53)
	at org.openqa.selenium.remote.JsonWireProtocolResponse.lambda$getResponseFunction$2(JsonWireProtocolResponse.java:91)
	at org.openqa.selenium.remote.ProtocolHandshake.lambda$createSession$0(ProtocolHandshake.java:123)
	at java.util.stream.ReferencePipeline$3$1.accept(ReferencePipeline.java:193)
	at java.util.Spliterators$ArraySpliterator.tryAdvance(Spliterators.java:958)
	at java.util.stream.ReferencePipeline.forEachWithCancel(ReferencePipeline.java:126)
	at java.util.stream.AbstractPipeline.copyIntoWithCancel(AbstractPipeline.java:498)
	at java.util.stream.AbstractPipeline.copyInto(AbstractPipeline.java:485)
	at java.util.stream.AbstractPipeline.wrapAndCopyInto(AbstractPipeline.java:471)
	at java.util.stream.FindOps$FindOp.evaluateSequential(FindOps.java:152)
	at java.util.stream.AbstractPipeline.evaluate(AbstractPipeline.java:234)
	at java.util.stream.ReferencePipeline.findFirst(ReferencePipeline.java:464)
	at org.openqa.selenium.remote.ProtocolHandshake.createSession(ProtocolHandshake.java:126)
	at org.openqa.selenium.remote.ProtocolHandshake.createSession(ProtocolHandshake.java:73)
	at org.openqa.selenium.remote.HttpCommandExecutor.execute(HttpCommandExecutor.java:138)
	at org.openqa.selenium.remote.RemoteWebDriver.execute(RemoteWebDriver.java:601)
	at org.openqa.selenium.remote.RemoteWebDriver.startSession(RemoteWebDriver.java:219)
	at org.openqa.selenium.remote.RemoteWebDriver.<init>(RemoteWebDriver.java:142)
	at org.openqa.selenium.remote.RemoteWebDriver.<init>(RemoteWebDriver.java:155)
	at unir.net.tfgii.selenium.drivers.MozillaFirefoxDriver.initDriver(MozillaFirefoxDriver.java:49)
	at unir.net.tfgii.selenium.init.SeleniumDriverOperations.testBeforeClass(SeleniumDriverOperations.java:54)
	at sun.reflect.NativeMethodAccessorImpl.invoke0(Native Method)
	at sun.reflect.NativeMethodAccessorImpl.invoke(NativeMethodAccessorImpl.java:62)
	at sun.reflect.DelegatingMethodAccessorImpl.invoke(DelegatingMethodAccessorImpl.java:43)
	at java.lang.reflect.Method.invoke(Method.java:498)
	at org.testng.internal.MethodInvocationHelper.invokeMethod(MethodInvocationHelper.java:80)
	at org.testng.internal.Invoker.invokeConfigurationMethod(Invoker.java:564)
	at org.testng.internal.Invoker.invokeConfigurations(Invoker.java:213)
	at org.testng.internal.Invoker.invokeConfigurations(Invoker.java:138)
	at org.testng.internal.TestMethodWorker.invokeBeforeClassMethods(TestMethodWorker.java:175)
	at org.testng.internal.TestMethodWorker.run(TestMethodWorker.java:107)
	at org.testng.TestRunner.privateRun(TestRunner.java:767)
	at org.testng.TestRunner.run(TestRunner.java:617)
	at org.testng.SuiteRunner.runTest(SuiteRunner.java:334)
	at org.testng.SuiteRunner.runSequentially(SuiteRunner.java:329)
	at org.testng.SuiteRunner.privateRun(SuiteRunner.java:291)
	at org.testng.SuiteRunner.run(SuiteRunner.java:240)
	at org.testng.SuiteRunnerWorker.runSuite(SuiteRunnerWorker.java:52)
	at org.testng.SuiteRunnerWorker.run(SuiteRunnerWorker.java:86)
	at org.testng.TestNG.runSuitesSequentially(TestNG.java:1198)
	at org.testng.TestNG.runSuitesLocally(TestNG.java:1123)
	at org.testng.TestNG.run(TestNG.java:1031)
	at org.apache.maven.surefire.testng.TestNGExecutor.run(TestNGExecutor.java:77)
	at org.apache.maven.surefire.testng.TestNGDirectoryTestSuite.executeMulti(TestNGDirectoryTestSuite.java:189)
	at org.apache.maven.surefire.testng.TestNGDirectoryTestSuite.execute(TestNGDirectoryTestSuite.java:105)
	at org.apache.maven.surefire.testng.TestNGProvider.invoke(TestNGProvider.java:117)
	at sun.reflect.NativeMethodAccessorImpl.invoke0(Native Method)
	at sun.reflect.NativeMethodAccessorImpl.invoke(NativeMethodAccessorImpl.java:62)
	at sun.reflect.DelegatingMethodAccessorImpl.invoke(DelegatingMethodAccessorImpl.java:43)
	at java.lang.reflect.Method.invoke(Method.java:498)
	at org.apache.maven.surefire.util.ReflectionUtils.invokeMethodWithArray2(ReflectionUtils.java:208)
	at org.apache.maven.surefire.booter.ProviderFactory$ProviderProxy.invoke(ProviderFactory.java:159)
	at org.apache.maven.surefire.booter.ProviderFactory.invokeProvider(ProviderFactory.java:87)
	at org.apache.maven.surefire.booter.ForkedBooter.runSuitesInProcess(ForkedBooter.java:153)
	at org.apache.maven.surefire.booter.ForkedBooter.main(ForkedBooter.java:95)
Caused by: org.openqa.grid.common.exception.GridException: Error forwarding the new session Error forwarding the request Connect to 169.254.3.218:5555 [/169.254.3.218] failed: Connection timed out: connect
	at org.openqa.grid.web.servlet.handler.RequestHandler.process(RequestHandler.java:117)
	at org.openqa.grid.web.servlet.DriverServlet.process(DriverServlet.java:84)
	at org.openqa.grid.web.servlet.DriverServlet.doPost(DriverServlet.java:68)
	at javax.servlet.http.HttpServlet.service(HttpServlet.java:707)
	at javax.servlet.http.HttpServlet.service(HttpServlet.java:790)
	at org.seleniumhq.jetty9.servlet.ServletHolder.handle(ServletHolder.java:841)
	at org.seleniumhq.jetty9.servlet.ServletHandler.doHandle(ServletHandler.java:535)
	at org.seleniumhq.jetty9.server.handler.ScopedHandler.nextHandle(ScopedHandler.java:188)
	at org.seleniumhq.jetty9.server.session.SessionHandler.doHandle(SessionHandler.java:1595)
	at org.seleniumhq.jetty9.server.handler.ScopedHandler.nextHandle(ScopedHandler.java:188)
	at org.seleniumhq.jetty9.server.handler.ContextHandler.doHandle(ContextHandler.java:1253)
	at org.seleniumhq.jetty9.server.handler.ScopedHandler.nextScope(ScopedHandler.java:168)
	at org.seleniumhq.jetty9.servlet.ServletHandler.doScope(ServletHandler.java:473)
	at org.seleniumhq.jetty9.server.session.SessionHandler.doScope(SessionHandler.java:1564)
	at org.seleniumhq.jetty9.server.handler.ScopedHandler.nextScope(ScopedHandler.java:166)
	at org.seleniumhq.jetty9.server.handler.ContextHandler.doScope(ContextHandler.java:1155)
	at org.seleniumhq.jetty9.server.handler.ScopedHandler.handle(ScopedHandler.java:141)
	at org.seleniumhq.jetty9.server.handler.HandlerWrapper.handle(HandlerWrapper.java:132)
	at org.seleniumhq.jetty9.server.Server.handle(Server.java:564)
	at org.seleniumhq.jetty9.server.HttpChannel.handle(HttpChannel.java:317)
	at org.seleniumhq.jetty9.server.HttpConnection.onFillable(HttpConnection.java:251)
	at org.seleniumhq.jetty9.io.AbstractConnection$ReadCallback.succeeded(AbstractConnection.java:279)
	at org.seleniumhq.jetty9.io.FillInterest.fillable(FillInterest.java:110)
	at org.seleniumhq.jetty9.io.ChannelEndPoint$2.run(ChannelEndPoint.java:124)
	at org.seleniumhq.jetty9.util.thread.Invocable.invokePreferred(Invocable.java:128)
	at org.seleniumhq.jetty9.util.thread.Invocable$InvocableExecutor.invoke(Invocable.java:222)
	at org.seleniumhq.jetty9.util.thread.strategy.EatWhatYouKill.doProduce(EatWhatYouKill.java:294)
	at org.seleniumhq.jetty9.util.thread.strategy.EatWhatYouKill.run(EatWhatYouKill.java:199)
	at org.seleniumhq.jetty9.util.thread.QueuedThreadPool.runJob(QueuedThreadPool.java:672)
	at org.seleniumhq.jetty9.util.thread.QueuedThreadPool$2.run(QueuedThreadPool.java:590)
	at java.lang.Thread.run(Thread.java:748)
2018-03-22 21:15:22.747 unir.net.tfgii.selenium.tests.Registro DEBUG - INICIO- Caso de Prueba de Registro
La url de inicio es: http://www.sgc-tfgii.es/index.html
2018-03-22 21:15:22.749 unir.net.tfgii.selenium.tests.base.BaseTestCase DEBUG - Cerrando el driver
Tests run: 2, Failures: 2, Errors: 0, Skipped: 0, Time elapsed: 115.306 sec <<< FAILURE!
login(unir.net.tfgii.selenium.tests.Login)  Time elapsed: 0.015 sec  <<< FAILURE!
java.lang.NullPointerException: null
	at unir.net.tfgii.selenium.tests.base.BaseTestCase.irUrlOrigen(BaseTestCase.java:32)
	at unir.net.tfgii.selenium.tests.Login.login(Login.java:35)

registro(unir.net.tfgii.selenium.tests.Registro)  Time elapsed: 0.006 sec  <<< FAILURE!
java.lang.NullPointerException: null
	at unir.net.tfgii.selenium.tests.base.BaseTestCase.irUrlOrigen(BaseTestCase.java:32)
	at unir.net.tfgii.selenium.tests.Registro.registro(Registro.java:30)


Results :

Failed tests: 
  Login.login:35->BaseTestCase.irUrlOrigen:32 » NullPointer
  Registro.registro:30->BaseTestCase.irUrlOrigen:32 » NullPointer

Tests run: 2, Failures: 2, Errors: 0, Skipped: 0

[INFO] ------------------------------------------------------------------------
[INFO] BUILD FAILURE
[INFO] ------------------------------------------------------------------------
[INFO] Total time: 01:58 min
[INFO] Finished at: 2018-03-22T21:15:23+01:00
[INFO] Final Memory: 12M/221M
[INFO] ------------------------------------------------------------------------
[ERROR] Failed to execute goal org.apache.maven.plugins:maven-surefire-plugin:2.14.1:test (default-test) on project pruebas-selenium: There are test failures.
[ERROR] 
[ERROR] Please refer to C:\Users\sergiog\.jenkins\workspace\Run_Tests_Remote_Secuencial\target\surefire-reports for the individual test results.
[ERROR] -> [Help 1]
[ERROR] 
[ERROR] To see the full stack trace of the errors, re-run Maven with the -e switch.
[ERROR] Re-run Maven using the -X switch to enable full debug logging.
[ERROR] 
[ERROR] For more information about the errors and possible solutions, please read the following articles:
[ERROR] [Help 1] http://cwiki.apache.org/confluence/display/MAVEN/MojoFailureException
Build step 'Conditional step (single)' marked build as failure
Finished: FAILURE
