Lanzada por el usuario [8mha:////4ASAjq7C/sSB4sIzq+4BVAAZsrwMTV3jKz30sL1zmxUIAAAAlx+LCAAAAAAAAP9b85aBtbiIQTGjNKU4P08vOT+vOD8nVc83PyU1x6OyILUoJzMv2y+/JJUBAhiZGBgqihhk0NSjKDWzXb3RdlLBUSYGJk8GtpzUvPSSDB8G5tKinBIGIZ+sxLJE/ZzEvHT94JKizLx0a6BxUmjGOUNodHsLgAzWEgZu/dLi1CL9xJTczDwAj6GcLcAAAAA=[0madmin
Ejecutando.en el espacio de trabajo C:\Users\sergiog\.jenkins\workspace\Run_Tests_Remote_Secuencial
Cloning the remote Git repository
Cloning repository https://github.com/sglezcasco/sgc-tfgii.git
 > git.exe init C:\Users\sergiog\.jenkins\workspace\Run_Tests_Remote_Secuencial # timeout=10
Fetching upstream changes from https://github.com/sglezcasco/sgc-tfgii.git
 > git.exe --version # timeout=10
 > git.exe fetch --tags --progress https://github.com/sglezcasco/sgc-tfgii.git +refs/heads/*:refs/remotes/origin/*
 > git.exe config remote.origin.url https://github.com/sglezcasco/sgc-tfgii.git # timeout=10
 > git.exe config --add remote.origin.fetch +refs/heads/*:refs/remotes/origin/* # timeout=10
 > git.exe config remote.origin.url https://github.com/sglezcasco/sgc-tfgii.git # timeout=10
Fetching upstream changes from https://github.com/sglezcasco/sgc-tfgii.git
 > git.exe fetch --tags --progress https://github.com/sglezcasco/sgc-tfgii.git +refs/heads/*:refs/remotes/origin/*
 > git.exe rev-parse "refs/remotes/origin/master^{commit}" # timeout=10
 > git.exe rev-parse "refs/remotes/origin/origin/master^{commit}" # timeout=10
Checking out Revision 634aa09871a9b18a96eeec3dcf86235a056718f3 (refs/remotes/origin/master)
 > git.exe config core.sparsecheckout # timeout=10
 > git.exe checkout -f 634aa09871a9b18a96eeec3dcf86235a056718f3
Commit message: "update httpcore dependencies in pom.xml"
First time build. Skipping changelog.
Run condition [Boolean condition] enabling prebuild for step [Ejecutar un comando de Windows]
Run condition [Boolean condition] enabling prebuild for step [Ejecutar un comando de Windows]
Run condition [Boolean condition] enabling prebuild for step [Ejecutar un comando de Windows]
Run condition [Boolean condition] enabling prebuild for step [Ejecutar un comando de Windows]
[Run_Tests_Remote_Secuencial] $ cmd /c call C:\Users\sergiog\AppData\Local\Temp\jenkins7379241785910581506.bat

C:\Users\sergiog\.jenkins\workspace\Run_Tests_Remote_Secuencial>mvn eclipse:eclipse 
[INFO] Scanning for projects...
[INFO]                                                                         
[INFO] ------------------------------------------------------------------------
[INFO] Building Selenium Tests 1.0.0
[INFO] ------------------------------------------------------------------------
[INFO] 
[INFO] >>> maven-eclipse-plugin:2.10:eclipse (default-cli) > generate-resources @ pruebas-selenium >>>
[INFO] 
[INFO] <<< maven-eclipse-plugin:2.10:eclipse (default-cli) < generate-resources @ pruebas-selenium <<<
[INFO] 
[INFO] --- maven-eclipse-plugin:2.10:eclipse (default-cli) @ pruebas-selenium ---
[INFO] Using Eclipse Workspace: null
[INFO] Adding default classpath container: org.eclipse.jdt.launching.JRE_CONTAINER/org.eclipse.jdt.internal.debug.ui.launcher.StandardVMType/JavaSE-1.8
[INFO] Wrote settings to C:\Users\sergiog\.jenkins\workspace\Run_Tests_Remote_Secuencial\.settings\org.eclipse.jdt.core.prefs
[INFO] Wrote Eclipse project for "pruebas-selenium" to C:\Users\sergiog\.jenkins\workspace\Run_Tests_Remote_Secuencial.
[INFO] 
[INFO] ------------------------------------------------------------------------
[INFO] BUILD SUCCESS
[INFO] ------------------------------------------------------------------------
[INFO] Total time: 2.352 s
[INFO] Finished at: 2018-03-18T21:49:51+01:00
[INFO] Final Memory: 15M/222M
[INFO] ------------------------------------------------------------------------
[Boolean condition] checking [false] against [^(1|y|yes|t|true|on|run)$] (origin token: ${Firefox})
Run condition [Boolean condition] preventing perform for step [Ejecutar un comando de Windows]
[Boolean condition] checking [false] against [^(1|y|yes|t|true|on|run)$] (origin token: ${Chrome})
Run condition [Boolean condition] preventing perform for step [Ejecutar un comando de Windows]
[Boolean condition] checking [false] against [^(1|y|yes|t|true|on|run)$] (origin token: ${Edge})
Run condition [Boolean condition] preventing perform for step [Ejecutar un comando de Windows]
[Boolean condition] checking [true] against [^(1|y|yes|t|true|on|run)$] (origin token: ${PhantomJS})
Run condition [Boolean condition] enabling perform for step [Ejecutar un comando de Windows]
[Run_Tests_Remote_Secuencial] $ cmd /c call C:\Users\sergiog\AppData\Local\Temp\jenkins2728927375374692641.bat

C:\Users\sergiog\.jenkins\workspace\Run_Tests_Remote_Secuencial>mvn -Dtest=unir.net.tfgii.selenium.tests.Login,unir.net.tfgii.selenium.tests.Registro -DdriverProvider=PhantomJSDriver -Dexecution=remote test  
[INFO] Scanning for projects...
[INFO]                                                                         
[INFO] ------------------------------------------------------------------------
[INFO] Building Selenium Tests 1.0.0
[INFO] ------------------------------------------------------------------------
[INFO] 
[INFO] --- maven-resources-plugin:2.6:resources (default-resources) @ pruebas-selenium ---
[INFO] Using 'UTF-8' encoding to copy filtered resources.
[INFO] skip non existing resourceDirectory C:\Users\sergiog\.jenkins\workspace\Run_Tests_Remote_Secuencial\src\main\resources
[INFO] 
[INFO] --- maven-compiler-plugin:3.3:compile (default-compile) @ pruebas-selenium ---
[INFO] No sources to compile
[INFO] 
[INFO] --- maven-resources-plugin:2.6:testResources (default-testResources) @ pruebas-selenium ---
[INFO] Using 'UTF-8' encoding to copy filtered resources.
[INFO] Copying 4 resources
[INFO] 
[INFO] --- maven-compiler-plugin:3.3:testCompile (default-testCompile) @ pruebas-selenium ---
[INFO] Changes detected - recompiling the module!
[INFO] Compiling 15 source files to C:\Users\sergiog\.jenkins\workspace\Run_Tests_Remote_Secuencial\target\test-classes
[INFO] 
[INFO] --- maven-surefire-plugin:2.14.1:test (default-test) @ pruebas-selenium ---
[INFO] Surefire report directory: C:\Users\sergiog\.jenkins\workspace\Run_Tests_Remote_Secuencial\target\surefire-reports

-------------------------------------------------------
 T E S T S
-------------------------------------------------------
Running TestSuite
Configuring TestNG with: TestNG652Configurator
2018-03-18 21:49:58.237 unir.net.tfgii.selenium.drivers.PhantomJSDriver DEBUG - Inicializando driver PhantomJS Remoto
2018-03-18 21:49:59.792 unir.net.tfgii.selenium.init.SeleniumDriverOperations ERROR - Could not start a new session. Possible causes are invalid address of the remote server or browser start-up failure.
Build info: version: '3.7.1', revision: '8a0099a', time: '2017-11-06T21:01:39.354Z'
System info: host: 'DESKTOP-BB2IEAS', ip: '169.254.116.234', os.name: 'Windows 10', os.arch: 'amd64', os.version: '10.0', java.version: '1.8.0_112'
Driver info: driver.version: PhantomJSDriver
org.openqa.selenium.remote.UnreachableBrowserException: Could not start a new session. Possible causes are invalid address of the remote server or browser start-up failure.
Build info: version: '3.7.1', revision: '8a0099a', time: '2017-11-06T21:01:39.354Z'
System info: host: 'DESKTOP-BB2IEAS', ip: '169.254.116.234', os.name: 'Windows 10', os.arch: 'amd64', os.version: '10.0', java.version: '1.8.0_112'
Driver info: driver.version: PhantomJSDriver
	at org.openqa.selenium.remote.RemoteWebDriver.execute(RemoteWebDriver.java:621)
	at org.openqa.selenium.remote.RemoteWebDriver.startSession(RemoteWebDriver.java:219)
	at org.openqa.selenium.remote.RemoteWebDriver.<init>(RemoteWebDriver.java:142)
	at org.openqa.selenium.remote.RemoteWebDriver.<init>(RemoteWebDriver.java:155)
	at unir.net.tfgii.selenium.drivers.PhantomJSDriver.initDriver(PhantomJSDriver.java:60)
	at unir.net.tfgii.selenium.init.SeleniumDriverOperations.testBeforeClass(SeleniumDriverOperations.java:54)
	at sun.reflect.NativeMethodAccessorImpl.invoke0(Native Method)
	at sun.reflect.NativeMethodAccessorImpl.invoke(NativeMethodAccessorImpl.java:62)
	at sun.reflect.DelegatingMethodAccessorImpl.invoke(DelegatingMethodAccessorImpl.java:43)
	at java.lang.reflect.Method.invoke(Method.java:498)
	at org.testng.internal.MethodInvocationHelper.invokeMethod(MethodInvocationHelper.java:80)
	at org.testng.internal.Invoker.invokeConfigurationMethod(Invoker.java:564)
	at org.testng.internal.Invoker.invokeConfigurations(Invoker.java:213)
	at org.testng.internal.Invoker.invokeConfigurations(Invoker.java:138)
	at org.testng.internal.TestMethodWorker.invokeBeforeClassMethods(TestMethodWorker.java:175)
	at org.testng.internal.TestMethodWorker.run(TestMethodWorker.java:107)
	at org.testng.TestRunner.privateRun(TestRunner.java:767)
	at org.testng.TestRunner.run(TestRunner.java:617)
	at org.testng.SuiteRunner.runTest(SuiteRunner.java:334)
	at org.testng.SuiteRunner.runSequentially(SuiteRunner.java:329)
	at org.testng.SuiteRunner.privateRun(SuiteRunner.java:291)
	at org.testng.SuiteRunner.run(SuiteRunner.java:240)
	at org.testng.SuiteRunnerWorker.runSuite(SuiteRunnerWorker.java:52)
	at org.testng.SuiteRunnerWorker.run(SuiteRunnerWorker.java:86)
	at org.testng.TestNG.runSuitesSequentially(TestNG.java:1198)
	at org.testng.TestNG.runSuitesLocally(TestNG.java:1123)
	at org.testng.TestNG.run(TestNG.java:1031)
	at org.apache.maven.surefire.testng.TestNGExecutor.run(TestNGExecutor.java:77)
	at org.apache.maven.surefire.testng.TestNGDirectoryTestSuite.executeMulti(TestNGDirectoryTestSuite.java:189)
	at org.apache.maven.surefire.testng.TestNGDirectoryTestSuite.execute(TestNGDirectoryTestSuite.java:105)
	at org.apache.maven.surefire.testng.TestNGProvider.invoke(TestNGProvider.java:117)
	at sun.reflect.NativeMethodAccessorImpl.invoke0(Native Method)
	at sun.reflect.NativeMethodAccessorImpl.invoke(NativeMethodAccessorImpl.java:62)
	at sun.reflect.DelegatingMethodAccessorImpl.invoke(DelegatingMethodAccessorImpl.java:43)
	at java.lang.reflect.Method.invoke(Method.java:498)
	at org.apache.maven.surefire.util.ReflectionUtils.invokeMethodWithArray2(ReflectionUtils.java:208)
	at org.apache.maven.surefire.booter.ProviderFactory$ProviderProxy.invoke(ProviderFactory.java:159)
	at org.apache.maven.surefire.booter.ProviderFactory.invokeProvider(ProviderFactory.java:87)
	at org.apache.maven.surefire.booter.ForkedBooter.runSuitesInProcess(ForkedBooter.java:153)
	at org.apache.maven.surefire.booter.ForkedBooter.main(ForkedBooter.java:95)
Caused by: org.apache.http.conn.HttpHostConnectException: Connect to 192.168.43.247:4444 [/192.168.43.247] failed: Connection refused: connect
	at org.apache.http.impl.conn.DefaultHttpClientConnectionOperator.connect(DefaultHttpClientConnectionOperator.java:159)
	at org.apache.http.impl.conn.PoolingHttpClientConnectionManager.connect(PoolingHttpClientConnectionManager.java:359)
	at org.apache.http.impl.execchain.MainClientExec.establishRoute(MainClientExec.java:381)
	at org.apache.http.impl.execchain.MainClientExec.execute(MainClientExec.java:237)
	at org.apache.http.impl.execchain.ProtocolExec.execute(ProtocolExec.java:185)
	at org.apache.http.impl.execchain.RetryExec.execute(RetryExec.java:89)
	at org.apache.http.impl.execchain.RedirectExec.execute(RedirectExec.java:111)
	at org.apache.http.impl.client.InternalHttpClient.doExecute(InternalHttpClient.java:185)
	at org.apache.http.impl.client.CloseableHttpClient.execute(CloseableHttpClient.java:72)
	at org.apache.http.impl.client.CloseableHttpClient.execute(CloseableHttpClient.java:56)
	at org.openqa.selenium.remote.internal.ApacheHttpClient.fallBackExecute(ApacheHttpClient.java:138)
	at org.openqa.selenium.remote.internal.ApacheHttpClient.execute(ApacheHttpClient.java:86)
	at org.openqa.selenium.remote.ProtocolHandshake.createSession(ProtocolHandshake.java:101)
	at org.openqa.selenium.remote.ProtocolHandshake.createSession(ProtocolHandshake.java:73)
	at org.openqa.selenium.remote.HttpCommandExecutor.execute(HttpCommandExecutor.java:142)
	at org.openqa.selenium.remote.RemoteWebDriver.execute(RemoteWebDriver.java:600)
	... 39 more
Caused by: java.net.ConnectException: Connection refused: connect
	at java.net.DualStackPlainSocketImpl.waitForConnect(Native Method)
	at java.net.DualStackPlainSocketImpl.socketConnect(DualStackPlainSocketImpl.java:85)
	at java.net.AbstractPlainSocketImpl.doConnect(AbstractPlainSocketImpl.java:350)
	at java.net.AbstractPlainSocketImpl.connectToAddress(AbstractPlainSocketImpl.java:206)
	at java.net.AbstractPlainSocketImpl.connect(AbstractPlainSocketImpl.java:188)
	at java.net.PlainSocketImpl.connect(PlainSocketImpl.java:172)
	at java.net.SocksSocketImpl.connect(SocksSocketImpl.java:392)
	at java.net.Socket.connect(Socket.java:589)
	at org.apache.http.conn.socket.PlainConnectionSocketFactory.connectSocket(PlainConnectionSocketFactory.java:75)
	at org.apache.http.impl.conn.DefaultHttpClientConnectionOperator.connect(DefaultHttpClientConnectionOperator.java:142)
	... 54 more
2018-03-18 21:49:59.810 unir.net.tfgii.selenium.tests.Login DEBUG - INICIO- Caso de Prueba de Login
La url de inicio es: http://www.sgc-tfgii.es/index.html
2018-03-18 21:49:59.820 unir.net.tfgii.selenium.tests.base.BaseTestCase DEBUG - Cerrando el driver
2018-03-18 21:49:59.822 unir.net.tfgii.selenium.drivers.PhantomJSDriver DEBUG - Inicializando driver PhantomJS Remoto
2018-03-18 21:50:00.842 unir.net.tfgii.selenium.init.SeleniumDriverOperations ERROR - Could not start a new session. Possible causes are invalid address of the remote server or browser start-up failure.
Build info: version: '3.7.1', revision: '8a0099a', time: '2017-11-06T21:01:39.354Z'
System info: host: 'DESKTOP-BB2IEAS', ip: '169.254.116.234', os.name: 'Windows 10', os.arch: 'amd64', os.version: '10.0', java.version: '1.8.0_112'
Driver info: driver.version: PhantomJSDriver
org.openqa.selenium.remote.UnreachableBrowserException: Could not start a new session. Possible causes are invalid address of the remote server or browser start-up failure.
Build info: version: '3.7.1', revision: '8a0099a', time: '2017-11-06T21:01:39.354Z'
System info: host: 'DESKTOP-BB2IEAS', ip: '169.254.116.234', os.name: 'Windows 10', os.arch: 'amd64', os.version: '10.0', java.version: '1.8.0_112'
Driver info: driver.version: PhantomJSDriver
	at org.openqa.selenium.remote.RemoteWebDriver.execute(RemoteWebDriver.java:621)
	at org.openqa.selenium.remote.RemoteWebDriver.startSession(RemoteWebDriver.java:219)
	at org.openqa.selenium.remote.RemoteWebDriver.<init>(RemoteWebDriver.java:142)
	at org.openqa.selenium.remote.RemoteWebDriver.<init>(RemoteWebDriver.java:155)
	at unir.net.tfgii.selenium.drivers.PhantomJSDriver.initDriver(PhantomJSDriver.java:60)
	at unir.net.tfgii.selenium.init.SeleniumDriverOperations.testBeforeClass(SeleniumDriverOperations.java:54)
	at sun.reflect.NativeMethodAccessorImpl.invoke0(Native Method)
	at sun.reflect.NativeMethodAccessorImpl.invoke(NativeMethodAccessorImpl.java:62)
	at sun.reflect.DelegatingMethodAccessorImpl.invoke(DelegatingMethodAccessorImpl.java:43)
	at java.lang.reflect.Method.invoke(Method.java:498)
	at org.testng.internal.MethodInvocationHelper.invokeMethod(MethodInvocationHelper.java:80)
	at org.testng.internal.Invoker.invokeConfigurationMethod(Invoker.java:564)
	at org.testng.internal.Invoker.invokeConfigurations(Invoker.java:213)
	at org.testng.internal.Invoker.invokeConfigurations(Invoker.java:138)
	at org.testng.internal.TestMethodWorker.invokeBeforeClassMethods(TestMethodWorker.java:175)
	at org.testng.internal.TestMethodWorker.run(TestMethodWorker.java:107)
	at org.testng.TestRunner.privateRun(TestRunner.java:767)
	at org.testng.TestRunner.run(TestRunner.java:617)
	at org.testng.SuiteRunner.runTest(SuiteRunner.java:334)
	at org.testng.SuiteRunner.runSequentially(SuiteRunner.java:329)
	at org.testng.SuiteRunner.privateRun(SuiteRunner.java:291)
	at org.testng.SuiteRunner.run(SuiteRunner.java:240)
	at org.testng.SuiteRunnerWorker.runSuite(SuiteRunnerWorker.java:52)
	at org.testng.SuiteRunnerWorker.run(SuiteRunnerWorker.java:86)
	at org.testng.TestNG.runSuitesSequentially(TestNG.java:1198)
	at org.testng.TestNG.runSuitesLocally(TestNG.java:1123)
	at org.testng.TestNG.run(TestNG.java:1031)
	at org.apache.maven.surefire.testng.TestNGExecutor.run(TestNGExecutor.java:77)
	at org.apache.maven.surefire.testng.TestNGDirectoryTestSuite.executeMulti(TestNGDirectoryTestSuite.java:189)
	at org.apache.maven.surefire.testng.TestNGDirectoryTestSuite.execute(TestNGDirectoryTestSuite.java:105)
	at org.apache.maven.surefire.testng.TestNGProvider.invoke(TestNGProvider.java:117)
	at sun.reflect.NativeMethodAccessorImpl.invoke0(Native Method)
	at sun.reflect.NativeMethodAccessorImpl.invoke(NativeMethodAccessorImpl.java:62)
	at sun.reflect.DelegatingMethodAccessorImpl.invoke(DelegatingMethodAccessorImpl.java:43)
	at java.lang.reflect.Method.invoke(Method.java:498)
	at org.apache.maven.surefire.util.ReflectionUtils.invokeMethodWithArray2(ReflectionUtils.java:208)
	at org.apache.maven.surefire.booter.ProviderFactory$ProviderProxy.invoke(ProviderFactory.java:159)
	at org.apache.maven.surefire.booter.ProviderFactory.invokeProvider(ProviderFactory.java:87)
	at org.apache.maven.surefire.booter.ForkedBooter.runSuitesInProcess(ForkedBooter.java:153)
	at org.apache.maven.surefire.booter.ForkedBooter.main(ForkedBooter.java:95)
Caused by: org.apache.http.conn.HttpHostConnectException: Connect to 192.168.43.247:4444 [/192.168.43.247] failed: Connection refused: connect
	at org.apache.http.impl.conn.DefaultHttpClientConnectionOperator.connect(DefaultHttpClientConnectionOperator.java:159)
	at org.apache.http.impl.conn.PoolingHttpClientConnectionManager.connect(PoolingHttpClientConnectionManager.java:359)
	at org.apache.http.impl.execchain.MainClientExec.establishRoute(MainClientExec.java:381)
	at org.apache.http.impl.execchain.MainClientExec.execute(MainClientExec.java:237)
	at org.apache.http.impl.execchain.ProtocolExec.execute(ProtocolExec.java:185)
	at org.apache.http.impl.execchain.RetryExec.execute(RetryExec.java:89)
	at org.apache.http.impl.execchain.RedirectExec.execute(RedirectExec.java:111)
	at org.apache.http.impl.client.InternalHttpClient.doExecute(InternalHttpClient.java:185)
	at org.apache.http.impl.client.CloseableHttpClient.execute(CloseableHttpClient.java:72)
	at org.apache.http.impl.client.CloseableHttpClient.execute(CloseableHttpClient.java:56)
	at org.openqa.selenium.remote.internal.ApacheHttpClient.fallBackExecute(ApacheHttpClient.java:138)
	at org.openqa.selenium.remote.internal.ApacheHttpClient.execute(ApacheHttpClient.java:86)
	at org.openqa.selenium.remote.ProtocolHandshake.createSession(ProtocolHandshake.java:101)
	at org.openqa.selenium.remote.ProtocolHandshake.createSession(ProtocolHandshake.java:73)
	at org.openqa.selenium.remote.HttpCommandExecutor.execute(HttpCommandExecutor.java:142)
	at org.openqa.selenium.remote.RemoteWebDriver.execute(RemoteWebDriver.java:600)
	... 39 more
Caused by: java.net.ConnectException: Connection refused: connect
	at java.net.DualStackPlainSocketImpl.waitForConnect(Native Method)
	at java.net.DualStackPlainSocketImpl.socketConnect(DualStackPlainSocketImpl.java:85)
	at java.net.AbstractPlainSocketImpl.doConnect(AbstractPlainSocketImpl.java:350)
	at java.net.AbstractPlainSocketImpl.connectToAddress(AbstractPlainSocketImpl.java:206)
	at java.net.AbstractPlainSocketImpl.connect(AbstractPlainSocketImpl.java:188)
	at java.net.PlainSocketImpl.connect(PlainSocketImpl.java:172)
	at java.net.SocksSocketImpl.connect(SocksSocketImpl.java:392)
	at java.net.Socket.connect(Socket.java:589)
	at org.apache.http.conn.socket.PlainConnectionSocketFactory.connectSocket(PlainConnectionSocketFactory.java:75)
	at org.apache.http.impl.conn.DefaultHttpClientConnectionOperator.connect(DefaultHttpClientConnectionOperator.java:142)
	... 54 more
2018-03-18 21:50:00.853 unir.net.tfgii.selenium.tests.Registro DEBUG - INICIO- Caso de Prueba de Registro
La url de inicio es: http://www.sgc-tfgii.es/index.html
2018-03-18 21:50:00.858 unir.net.tfgii.selenium.tests.base.BaseTestCase DEBUG - Cerrando el driver
Tests run: 2, Failures: 2, Errors: 0, Skipped: 0, Time elapsed: 3.731 sec <<< FAILURE!
login(unir.net.tfgii.selenium.tests.Login)  Time elapsed: 0.013 sec  <<< FAILURE!
java.lang.NullPointerException: null
	at unir.net.tfgii.selenium.tests.base.BaseTestCase.irUrlOrigen(BaseTestCase.java:32)
	at unir.net.tfgii.selenium.tests.Login.login(Login.java:35)

registro(unir.net.tfgii.selenium.tests.Registro)  Time elapsed: 0.002 sec  <<< FAILURE!
java.lang.NullPointerException: null
	at unir.net.tfgii.selenium.tests.base.BaseTestCase.irUrlOrigen(BaseTestCase.java:32)
	at unir.net.tfgii.selenium.tests.Registro.registro(Registro.java:30)


Results :

Failed tests: 
  Login.login:35->BaseTestCase.irUrlOrigen:32 » NullPointer
  Registro.registro:30->BaseTestCase.irUrlOrigen:32 » NullPointer

Tests run: 2, Failures: 2, Errors: 0, Skipped: 0

[INFO] ------------------------------------------------------------------------
[INFO] BUILD FAILURE
[INFO] ------------------------------------------------------------------------
[INFO] Total time: 8.338 s
[INFO] Finished at: 2018-03-18T21:50:01+01:00
[INFO] Final Memory: 19M/208M
[INFO] ------------------------------------------------------------------------
[ERROR] Failed to execute goal org.apache.maven.plugins:maven-surefire-plugin:2.14.1:test (default-test) on project pruebas-selenium: There are test failures.
[ERROR] 
[ERROR] Please refer to C:\Users\sergiog\.jenkins\workspace\Run_Tests_Remote_Secuencial\target\surefire-reports for the individual test results.
[ERROR] -> [Help 1]
[ERROR] 
[ERROR] To see the full stack trace of the errors, re-run Maven with the -e switch.
[ERROR] Re-run Maven using the -X switch to enable full debug logging.
[ERROR] 
[ERROR] For more information about the errors and possible solutions, please read the following articles:
[ERROR] [Help 1] http://cwiki.apache.org/confluence/display/MAVEN/MojoFailureException
Build step 'Conditional step (single)' marked build as failure
Finished: FAILURE
